{
  "$schema": "https://json-schema.org/draft/2020-12/schema",
  "type": "object",
  "properties": {
    "schema_version": {
      "type": "string",
      "const": "1.0.0"
    },
    "id": {
      "type": "string",
      "format": "uuid",
      "pattern": "^([0-9a-fA-F]{8}-[0-9a-fA-F]{4}-[1-8][0-9a-fA-F]{3}-[89abAB][0-9a-fA-F]{3}-[0-9a-fA-F]{12}|00000000-0000-0000-0000-000000000000|ffffffff-ffff-ffff-ffff-ffffffffffff)$"
    },
    "session_id": {
      "type": "string",
      "format": "uuid",
      "pattern": "^([0-9a-fA-F]{8}-[0-9a-fA-F]{4}-[1-8][0-9a-fA-F]{3}-[89abAB][0-9a-fA-F]{3}-[0-9a-fA-F]{12}|00000000-0000-0000-0000-000000000000|ffffffff-ffff-ffff-ffff-ffffffffffff)$"
    },
    "owner_id": {
      "type": "string",
      "format": "uuid",
      "pattern": "^([0-9a-fA-F]{8}-[0-9a-fA-F]{4}-[1-8][0-9a-fA-F]{3}-[89abAB][0-9a-fA-F]{3}-[0-9a-fA-F]{12}|00000000-0000-0000-0000-000000000000|ffffffff-ffff-ffff-ffff-ffffffffffff)$"
    },
    "title": {
      "type": "string",
      "minLength": 1,
      "maxLength": 500
    },
    "assignee_label": {
      "anyOf": [
        {
          "type": "string",
          "minLength": 1,
          "maxLength": 200
        },
        {
          "type": "null"
        }
      ]
    },
    "due_at_ms": {
      "anyOf": [
        {
          "type": "integer",
          "minimum": 0,
          "maximum": 9007199254740991
        },
        {
          "type": "null"
        }
      ]
    },
    "status": {
      "type": "string",
      "enum": [
        "open",
        "done",
        "dismissed"
      ]
    },
    "evidence_ids": {
      "minItems": 1,
      "type": "array",
      "items": {
        "type": "string",
        "format": "uuid",
        "pattern": "^([0-9a-fA-F]{8}-[0-9a-fA-F]{4}-[1-8][0-9a-fA-F]{3}-[89abAB][0-9a-fA-F]{3}-[0-9a-fA-F]{12}|00000000-0000-0000-0000-000000000000|ffffffff-ffff-ffff-ffff-ffffffffffff)$"
      }
    },
    "created_at_ms": {
      "type": "integer",
      "minimum": 0,
      "maximum": 9007199254740991
    }
  },
  "required": [
    "schema_version",
    "id",
    "session_id",
    "owner_id",
    "title",
    "assignee_label",
    "due_at_ms",
    "status",
    "evidence_ids",
    "created_at_ms"
  ],
  "additionalProperties": false
}
